"Polypodium","virginianum","rock-cap fern",0,0,1,0,0,0,0,0,0,0,1,0,0,1,0,0,0,0,"fern","3","rocks, cliffs, E MN","4-12 in",,"moist","shade",0.333333333333333,1,,,0,0,1,0,0,1,0,0,1,0,0,1,0,0,0,1,0,0,0,0,0,0,0,0,0,0,0,1,0,0,,,,,,,,"Burntside Islands, Crystal Spring, Falls Creek, Hemlock Ravine, Kawishiwi Pines, Kettle River, Lawrence Creek, Lost Lake Peatland"
"Polystichum","acrostichoides","Christmas fern",0,1,0,0,0,1,0,0,0,0,0,0,0,1,0,0,1,0,"fern","3","uplands, SE MN","18-24 in",,"fertile, well-drained","partial shade to full shade",1.5,2,,,0,0,0,0,0,0,0,0,1,0,0,1,0,0,0,1,1,1,0,0,0,0,0,0,,,,,,,,,,,,,,
"Polystichum","braunii","Braun's holly fern",0,0,1,0,0,0,0,0,0,0,0,0,0,1,0,0,0,0,"fern","3","gorges, NE MN",,,"moist",,,,,,0,0,1,0,0,0,0,0,0,0,0,1,0,,,,,,,,,,,,0,0,0,1,0,0,,,,,,,,
"Pontederia","cordata","pickerelweed",0,0,0,0,0,0,0,0,0,0,0,0,1,0,0,0,0,0,"flower & groundcover","4","marshes, streams, shallow lakes, ponds, E MN","1-2 ft",,"fertile, heavy loam, submerged","full sun to partial shade",1,2,,,0,0,1,0,0,1,0,0,1,0,0,0,1,0,0,0,0,1,1,1,1,1,1,1,0,0,0,0,0,1,,,,,,,,
"Populus","deltoides","eastern cottonwood",0,0,0,0,0,0,0,1,0,0,0,0,0,0,0,0,0,0,"deciduous tree","3","streamside, riverside, lakeside, throughout MN","70-100 ft",,,,70,100,,,1,1,1,1,1,1,1,1,1,0,0,1,0,,,,,,,,,,,,,,,,,,,,,,,,,"Blaine Preserve, Blanket Flower Prairie, Cannon River Turtle Preserve, Chamberlain Woods, Chisholm Point Island, Clinton Falls Dwarf Trout Lily, Des Moines River, Grey Cloud Dunes, Kellogg Weaver Dunes, Langhei Prairie, Lost Valley Prairie, Mound Prairie, Mound Spring Prairie, Quarry Park, River Warren Outcrops, Savage Fen, Seminary Fen, Townsend Woods, Whitney Island, Wild Indigo, Wood-Rill, Zumbro Falls Woods"
"Populus","grandidentata","big-toothed aspen",0,0,0,0,0,0,0,1,0,0,0,0,0,0,0,0,0,0,"deciduous tree","3","E 2/3 MN",,,"moist",,,,,,0,1,1,0,1,1,0,1,1,0,0,1,0,,,,,,,,,,,,0,0,0,1,0,0,,,,,,,,"Avon Hills Forest, Botany Bog, Chisholm Point Island, Falls Creek, Hemlock Ravine, Itasca Wilderness Sanctuary, Kettle River, Mille Lacs Moraine, Moose Mountain, North Fork Zumbro Woods, Potato Lake, Prairie Creek Woods, Purvis Lake-Ober Foundation, Rushford Sand Barrens, Twin Lakes, Uncas Dunes, Wood-Rill, Wykoff Balsam Fir"
"Populus","tremuloides","quaking aspen",0,0,0,0,0,0,0,1,0,0,0,0,0,0,0,0,0,0,"deciduous tree","3","throughout MN","65 ft",,,,65,65,,,1,1,1,1,1,1,1,1,1,0,0,1,0,,,,,,,,,,,,,,,,,,,,,,,,,"Avon Hills Forest, Big Island, Black Lake Bog, Blaine Preserve, Blanket Flower Prairie, Bluestem Prairie, Boltuck-Rice Forever Wild, Botany Bog, Burntside Islands, Cannon River Turtle Preserve, Cherry Grove Blind Valley, Chimney Rock, Chisholm Point Island, Dinner Creek, Englund Ecotone, Felton Prairie, Franconia Bluffs, Frenchman's Bluff, Gustafson's Camp, Harry W. Cater Homestead Prairie, Hastings Sand Coulee, Helen Allison Savanna, Hemlock Ravine, Hole in the Bog Peatland, Hovland Woods, Iron Horse Prairie, Itasca Wilderness Sanctuary, Kawishiwi Pines, Kettle River, King's and Queen's Bluffs, Lawrence Creek, Lester Lake, Little Too Much Lake, Lost 40, Lost Lake Peatland, Lost Valley Prairie, McGregor Marsh, Moose Mountain, Myhr Creek Ridge, Pembina Trail, Potato Lake, Purvis Lake-Ober Foundation, Quarry Park, Racine Prairie, River Warren Outcrops, Sedan Brook Prairie, Seminary Fen, Spring Creek Prairie, St. Wendel Tamarack Bog, Sugarloaf Point, Swedes Forest, Twin Lakes, Two Rivers Aspen Parkland, Uncas Dunes, Wabu Woods, Watrous Island, Wild Indigo, Zumbro Falls Woods"
"Potentilla","arguta","tall cinquefoil",0,0,0,0,0,0,0,0,0,0,0,0,0,0,0,0,0,0,"flower & groundcover","2","throughout MN","1-3 ft",,"dry","full sun",1,3,,,1,1,1,1,1,1,1,1,1,0,1,0,0,0,0,0,0,0,0,0,0,0,0,1,1,0,0,0,0,0,,,,,,,,"Agassiz Dunes, Blanket Flower Prairie, Bluestem Prairie, Bonanza Prairie, Cedar Mountain, Cedar Rock, Compass Prairie, Cottonwood River Prairie, Des Moines River, Felton Prairie, Frenchman's Bluff, Glynn Prairie, Grey Cloud Dunes, Hastings Sand Coulee, Helen Allison Savanna, Kasota Prairie, King's and Queen's Bluffs, Lake Bronson Parkland, Lost Valley Prairie, Mound Spring Prairie, Pembina Trail, Pin Oak Prairie, Prairie Coteau, Ripley Esker, Rock Ridge Prairie, Rock Ridge Prairie, Roscoe Prairie, St. Croix Savanna, Swedes Forest, Uncas Dunes, Verlyn Marth Memorial Prairie, Wild Indigo, Wild Indigo, Yellow Bank Hills"
"Potentilla","fruticosa","shrubby cinquefoil",0,0,0,1,1,0,0,0,0,1,0,0,0,0,0,0,0,1,"deciduous shrub & small tree","2","bogs, rocky outcroppings, NW MN, NE MN, east-central MN","1-4 ft","1-4 ft","moist, well-drained","full sun to light shade",1,4,1,4,1,0,1,0,0,1,0,0,0,0,1,0,0,0,0,0,0,0,1,1,1,1,1,1,0,0,0,1,0,0,,,,,,,,
"Potentilla","tridentata","three-toothed cinquefoil",0,0,1,0,0,0,0,0,0,1,0,0,0,0,0,0,0,0,"flower & groundcover","2","NE MN","3-8 in",,"cool, acidic, well-drained, sandy or gravelly","full sun to partial shade",0.25,0.666666666666667,,,0,0,1,0,0,0,0,0,0,0,1,0,0,0,0,0,0,1,1,1,1,1,1,1,,,,,,,1,0,0,0,0,0,0,
"Prunus","nigra","Canadian plum",0,0,0,0,1,0,1,0,0,0,0,0,0,0,0,0,0,1,"deciduous shrub & small tree","3","all but SW MN",,,,,,,,,1,1,1,1,1,1,0,1,1,0,0,1,0,,,,,,,,,,,,,,,,,,,,,,,,,"Itasca Wilderness Sanctuary"
"Prunus","americana","wild plum",1,0,0,0,0,0,1,0,0,0,0,0,0,0,0,0,0,0,"deciduous shrub & small tree","3","woodland edges, S MN, W MN","15-20 ft","15-20 ft","well-drained","full sun",15,20,15,20,1,0,0,1,0,0,1,1,1,0,0,1,0,0,0,0,0,0,0,0,0,0,0,1,,,,,,,,,,,,,,"Cedar Mountain, Chimney Rock, Des Moines River, Frenchman's Bluff, Grey Cloud Dunes, Harry W. Cater Homestead Prairie, Hastings Sand Coulee, Itasca Wilderness Sanctuary, Kellogg Weaver Dunes, Lost Valley Prairie, Mound Spring Prairie, Pin Oak Prairie, Prairie Bush Clover, Prairie Coteau, Townsend Woods, Uncas Dunes, Verlyn Marth Memorial Prairie"
"Prunus","pensylvanica","pin cherry",0,0,0,0,0,0,1,0,0,0,0,0,0,0,0,0,0,0,"deciduous shrub & small tree","3","open hillsides, throughout MN","15-30 ft",,,,15,30,,,1,1,1,1,1,1,1,1,1,0,0,1,0,,,,,,,,,,,,,,,,,,,,,,,,,"Boot Lake, Hastings Sand Coulee, Hovland Woods, Kettle River, Lester Lake, Lutsen, Pin Oak Prairie, Purvis Lake-Ober Foundation, Racine Prairie, Spring Beauty Northern Hardwoods, Sugarloaf Point, Uncas Dunes"
"Prunus","pumila","sand cherry",1,0,0,0,0,0,1,0,0,0,0,0,0,0,0,0,0,0,"deciduous shrub & small tree","3","open hillsides, throughout MN","1-3 ft",,,,1,3,,,1,1,1,1,1,1,1,1,1,0,0,1,0,,,,,,,,,,,,,,,,,,,,,,,,,"Bluestem Prairie, Felton Prairie, Frenchman's Bluff, Harry W. Cater Homestead Prairie, Hastings Sand Coulee, Helen Allison Savanna, Itasca Wilderness Sanctuary, Kellogg Weaver Dunes, Lake Bronson Parkland, Lost Valley Prairie, Pembina Trail, Rice Lake Savanna, Sandpiper Prairie, Spring Creek Prairie, Two Rivers Aspen Parkland, Uncas Dunes"
"Prunus","serotina","black cherry",0,1,0,0,0,0,1,0,0,0,0,0,0,0,0,0,0,0,"deciduous tree","3","S MN","50-75 ft","40-50 ft","moist, slightly acidic, fertile","full sun",50,75,40,50,0,0,0,0,0,0,1,1,1,0,0,1,0,0,0,0,0,0,0,0,0,0,0,1,0,0,0,1,0,0,0,0,1,0,0,0,0,"Avon Hills Forest, Boot Lake, Brownsville Bluff, Cannon River Trout Lily, Cherry Grove Blind Valley, Chimney Rock, Crystal Spring, Englund Ecotone, Falls Creek, Franconia Bluffs, Harry W. Cater Homestead Prairie, Hastings Sand Coulee, Helen Allison Savanna, Itasca Wilderness Sanctuary, Kettle River, King's and Queen's Bluffs, Lawrence Creek, Lost Valley Prairie, Mound Prairie, North Fork Zumbro Woods, Oronoco Prairie, Pine Bend Bluffs, Prairie Creek Woods, Quarry Park, Rushford Sand Barrens, Spring Beauty Northern Hardwoods, Spring Creek Prairie, Twin Lakes, Uncas Dunes, Wild Indigo, Wolsfeld Woods, Wood-Rill, Wykoff Balsam Fir"
"Prunus","virginiana","chokeberry",1,0,0,0,0,0,1,0,0,0,0,0,0,0,0,0,0,0,"deciduous shrub & small tree","3, trial in 2","throughout MN","15-35 ft","25 ft",,,15,35,25,25,1,1,1,1,1,1,1,1,1,0,1,1,0,,,,,,,,,,,,,,,,,,,,,,,,,"Avon Hills Forest, Big Island, Boltuck-Rice Forever Wild, Boot Lake, Botany Bog, Cannon River Trout Lily, Chisholm Point Island, Clinton Falls Dwarf Trout Lily, Crystal Spring, Dinner Creek, Falls Creek, Franconia Bluffs, Frenchman's Bluff, Glynn Prairie, Gully Fen, Gustafson's Camp, Hastings Sand Coulee, Helen Allison Savanna, Hemlock Ravine, Hole in the Bog Peatland, Iona's Beach, Itasca Wilderness Sanctuary, Kellogg Weaver Dunes, Kettle River, King's and Queen's Bluffs, Lake Alexander Woods, Lawrence Creek, Lester Lake, Lost 40, Lundblad Prairie, Lutsen, McGregor Marsh, Mille Lacs Moraine, Mississippi River Islands, Moose Mountain, Mound Prairie, Mound Spring Prairie, North Fork Zumbro Woods, Oronoco Prairie, Partch Woods, Pin Oak Prairie, Pine Bend Bluffs, Prairie Bush Clover, Prairie Creek Woods, Quarry Park, Rushford Sand Barrens, Spring Beauty Northern Hardwoods, Sugarloaf Point, Swedes Forest, Townsend Woods, Twin Lakes, Uncas Dunes, Wabu Woods, Whitney Island, Wild Indigo, Wolsfeld Woods, Wood-Rill, Wykoff Balsam Fir"
"Pteridium","aquilinum","bracken",0,0,1,0,0,0,0,0,0,0,0,0,0,1,0,0,0,0,"fern","3","woods, all but SW MN","13-48 in",,"well-drained","partial sun",1.08333333333333,4,,,1,1,1,1,1,1,0,1,1,0,0,1,0,0,0,0,0,0,0,0,0,1,0,0,,,,,,,,,,,,,,"Avon Hills Forest, Black Lake Bog, Boltuck-Rice Forever Wild, Boot Lake, Botany Bog, Burntside Islands, Dinner Creek, Englund Ecotone, Hemlock Ravine, Hole in the Bog Peatland, Hovland Woods, Itasca Wilderness Sanctuary, Kawishiwi Pines, Kettle River, King's and Queen's Bluffs, Lake Alexander Woods, Lester Lake, Lost 40, McGregor Marsh, Mille Lacs Moraine, Moose Mountain, Mound Prairie, Potato Lake, Purvis Lake-Ober Foundation, Quarry Park, Rushford Sand Barrens, Twin Lakes, Uncas Dunes, Wykoff Balsam Fir"
"Pulsatilla","patens","pasque flower",1,0,0,0,1,0,0,0,0,1,0,0,0,0,0,1,0,0,"flower & groundcover","2","prairies, savannas, SW MN","6-12 in",,"dry, well-drained","full sun to very light shade",0.5,1,,,0,0,0,0,0,0,1,0,0,0,1,0,0,0,0,0,0,0,0,1,1,1,1,1,1,0,0,0,0,0,,,,,,,,
"Pycnanthemum","virginianum","Virginia mountain mint",1,0,0,0,0,0,1,0,0,0,0,0,0,1,0,0,0,0,"flower & groundcover","3","mesic open woods, prairies, SW MN","2-3 ft",,"moist, humus-rich","full sun",2,3,,,0,0,0,0,0,0,1,0,0,0,0,1,0,0,0,0,0,0,0,0,0,0,0,1,0,0,0,1,0,0,,,,,,,,"Blaine Preserve, Blanket Flower Prairie, Bluestem Prairie, Butternut Valley Prairie, Cedar Mountain, Cottonwood River Prairie, Felton Prairie, Grey Cloud Dunes, Harry W. Cater Homestead Prairie, Helen Allison Savanna, Holthe Prairie, Hythecker Prairie, Iron Horse Prairie, Joseph A. Tauer Prairie, Langhei Prairie, Lost Valley Prairie, Pembina Trail, Pin Oak Prairie, Prairie Bush Clover, Quarry Park, Roscoe Prairie, Sandpiper Prairie, Santee Prairie, Savage Fen, Sedan Brook Prairie, Seminary Fen, Shooting Star Prairie, Swedes Forest, Twin Valley Prairie, Wild Indigo"
"Quercus","alba","white oak",1,1,0,1,0,0,0,1,0,0,0,0,0,0,0,0,0,1,"deciduous tree","4, trial in 3","SE MN","50-75 ft","40-60 ft","fertile, acidic, heavy","full sun",50,75,40,60,0,0,0,0,0,0,0,0,1,0,0,1,1,0,0,0,0,0,0,0,0,0,0,1,,,,,,,1,0,0,0,0,0,0,"Avon Hills Forest, Boot Lake, Cannon River Trout Lily, Chimney Rock, Clinton Falls Dwarf Trout Lily, Crystal Spring, King's and Queen's Bluffs, Lawrence Creek, Mary Schmidt Crawford Woods, Mound Prairie, North Fork Zumbro Woods, Prairie Creek Woods, Rushford Sand Barrens, Wild Indigo, Wolsfeld Woods, Wood-Rill, Wykoff Balsam Fir, Zumbro Falls Woods"
"Quercus","bicolor","swamp white oak",0,0,0,1,0,0,0,1,0,0,0,0,0,1,0,0,0,1,"deciduous tree","4","SE MN","40-65 ft",,,,40,65,,,0,0,0,0,0,0,0,0,1,0,0,0,1,,,,,,,,,,,,,,,,,,,,,,,,,
"Quercus","ellipsoidalis","northern pin oak",1,1,0,1,0,0,0,1,0,0,0,0,0,0,0,0,0,1,"deciduous tree","3","E MN","45-65 ft",,,,45,65,,,0,0,1,0,0,1,0,0,1,0,0,1,0,,,,,,,,,,,,,,,,,,,,,,,,,"Avon Hills Forest, Boot Lake, Cherry Grove Blind Valley, Chimney Rock, Clear Lake, Englund Ecotone, Grey Cloud Dunes, Hastings Sand Coulee, Helen Allison Savanna, King's and Queen's Bluffs, Mound Prairie, Pin Oak Prairie, Pine Bend Bluffs, Quarry Park, Rushford Sand Barrens, St. Wendel Tamarack Bog, Uncas Dunes, Wild Indigo, Wood-Rill"
"Quercus","macrocarpa","bur oak",1,0,0,1,0,0,0,1,0,0,0,0,0,0,0,0,0,1,"deciduous tree","3","throughout MN","50-80 ft",,,,50,80,,,1,1,1,1,1,1,1,1,1,0,0,1,0,,,,,,,,,,,,,,,,,,,,,,,,,"Avon Hills Forest, Big Island, Blanket Flower Prairie, Boltuck-Rice Forever Wild, Botany Bog, Brownsville Bluff, Cannon River Turtle Preserve, Cedar Mountain, Cherry Grove Blind Valley, Chimney Rock, Chisholm Point Island, Clear Lake, Englund Ecotone, Gneiss Outcrops, Grey Cloud Dunes, Gully Fen, Harry W. Cater Homestead Prairie, Hastings Sand Coulee, Helen Allison Savanna, Hole in the Bog Peatland, Itasca Wilderness Sanctuary, Kettle River, King's and Queen's Bluffs, Lawrence Creek, Lester Lake, Little Too Much Lake, McGregor Marsh, Mississippi Oxbow, Mound Prairie, North Fork Zumbro Woods, Pine Bend Bluffs, Prairie Bush Clover, Prairie Creek Woods, Purvis Lake-Ober Foundation, Quarry Park, Rice Lake Savanna, River Warren Outcrops, Rushford Sand Barrens, Seminary Fen, Spring Creek Prairie, St. Croix Savanna, St. Wendel Tamarack Bog, Swedes Forest, Townsend Woods, Twin Lakes, Two Rivers Aspen Parkland, Uncas Dunes, Verlyn Marth Memorial Prairie, Watrous Island, Whitney Island, Wild Indigo, Wolsfeld Woods, Wood-Rill, Wykoff Balsam Fir, Zumbro Falls Woods"
"Quercus","rubra","red oak",0,1,0,1,0,0,0,1,0,0,0,0,0,0,0,0,0,1,"deciduous tree","4, trial in 3","E MN","50-80 ft",,"sandy loam, well-drained, acidic",,50,80,,,0,0,1,0,0,1,0,0,1,0,0,1,1,,,,,,,,,,,,,,,,,,1,0,0,0,0,0,0,"Avon Hills Forest, Badoura Jack Pine Woodland, Bald Eagle Bluff, Boot Lake, Brownsville Bluff, Cannon River Trout Lily, Cannon River Turtle Preserve, Chimney Rock, Crystal Spring, Falls Creek, Franconia Bluffs, Gully Fen, Harry W. Cater Homestead Prairie, Hastings, Hemlock Ravine, Hole in the Bog Peatland, Iron Springs Bog, Itasca Wilderness Sanctuary, Kettle River, King's and Queen's Bluffs, Lake Alexander Woods, Lawrence Creek, Lester Lake, Mary Schmidt Crawford Woods, Mille Lacs Moraine, Moose Mountain, North Fork Zumbro Woods, Partch Woods, Pine Bend Bluffs, Potato Lake, Prairie Creek Woods, Quarry Park, Ripley Esker, River Warren Outcrops, Rushford Sand Barrens, Savage Fen, Seminary Fen, Spring Creek Prairie, St. Wendel Tamarack Bog, Townsend Woods, Twin Lakes, Wabu Woods, Whitney Island, Wolsfeld Woods, Wood-Rill, Wykoff Balsam Fir, Zumbro Falls Woods"
"Ratibida","columnifera","Mexican hat, prairie coneflower",0,0,0,0,1,0,1,0,0,1,0,0,0,0,0,0,0,0,"flower & groundcover","3","prairies, savannas, W MN","1-3 ft",,"average to rich, well-drained","full sun to light shade",1,3,,,1,0,0,1,0,0,1,0,0,0,0,1,0,0,0,0,0,0,1,1,1,1,1,1,,,,,,,,,,,,,,"Blanket Flower Prairie, Bluestem Prairie, Cottonwood River Prairie, Felton Prairie, Glynn Prairie, Gneiss Outcrops, Mound Spring Prairie, Prairie Coteau, Yellow Bank Hills"
"Ratibida","pinnata","gray-headed coneflower",0,0,0,0,1,0,1,0,0,1,0,0,0,0,0,1,0,0,"flower & groundcover","3","prairies, savannas, S MN","3-5 ft",,"average to rich, well-drained","full sun to light shade",3,5,,,0,0,0,0,0,0,1,1,1,0,0,1,0,0,0,0,0,0,1,1,1,1,1,1,,,,,,,,,,,,,,"Butternut Valley Prairie, Cherry Grove Blind Valley, Compass Prairie, Cottonwood River Prairie, Des Moines River, Glynn Prairie, Grey Cloud Dunes, Hastings Sand Coulee, Hythecker Prairie, Iron Horse Prairie, Joseph A. Tauer Prairie, Kasota Prairie, King's and Queen's Bluffs, Lost Valley Prairie, Lundblad Prairie, Oronoco Prairie, Osmundson Prairie, Prairie Coteau, Racine Prairie, Savage Fen, Shooting Star Prairie, Spring Creek Prairie, Swedes Forest, Verlyn Marth Memorial Prairie, Wild Indigo"
"Rhus","glabra","smooth sumac",1,0,0,0,0,0,0,0,0,0,0,0,0,0,0,0,0,0,"deciduous shrub & small tree","3","forest edges, throughout MN","10-15 ft","10-15 ft","not wet or boggy","full sun",10,15,10,15,1,1,1,1,1,1,1,1,1,0,0,1,0,0,0,0,0,0,0,0,0,0,0,1,1,1,1,1,0,0,,,,,,,,"Blanket Flower Prairie, Bonanza Prairie, Cannon River Turtle Preserve, Cedar Mountain, Cherry Grove Blind Valley, Chimney Rock, Gneiss Outcrops, Grey Cloud Dunes, Hastings Sand Coulee, Helen Allison Savanna, Kellogg Weaver Dunes, King's and Queen's Bluffs, Lost Valley Prairie, Mound Prairie, Oronoco Prairie, Quarry Park, Rushford Sand Barrens, Spring Creek Prairie, Swedes Forest, Wild Indigo, Wood-Rill, Zumbro Falls Woods"
"Rhus","typhina","staghorn sumac",0,0,0,0,0,0,1,0,0,0,0,0,0,0,0,0,0,0,"deciduous shrub & small tree","4, trial in 3","forest edges, E MN","10-25 ft",,,,10,25,,,0,0,1,0,0,1,0,0,1,0,0,1,1,,,,,,,,,,,,,,,,,,,,,,,,,"Whitney Island"
"Rosa","acicularis","prickly rose",0,0,1,0,0,0,1,0,0,0,0,0,0,0,0,0,0,0,"deciduous shrub & small tree","2","coniferous woods, NE MN","3 ft",,"slightly acidic, humus-rich",,3,3,,,0,0,1,0,0,0,0,0,0,0,1,0,0,,,,,,,,,,,,,,,,,,0,0,1,0,0,0,0,"Badoura Jack Pine Woodland, Big Island, Botany Bog, Butterwort Cliffs, Gully Fen, Gustafson's Camp, Itasca Wilderness Sanctuary, Ladies Tresses Swamp, Lost 40, Lost Lake Peatland, Lutsen, McGregor Marsh, Myhr Creek Ridge, Potato Lake, Sprague Creek Peatland, Sugarloaf Point, Watrous Island"
"Rosa","arkansana","prairie rose",1,0,0,0,0,0,1,0,0,0,0,0,0,0,0,0,0,0,"deciduous shrub & small tree","3","prairies, all but north-central MN","2 ft","4-8 ft",,,2,2,4,8,1,0,1,1,1,1,1,1,1,0,0,1,0,,,,,,,,,,,,,,,,,,,,,,,,,"Blanket Flower Prairie, Bluestem Prairie, Bonanza Prairie, Butternut Valley Prairie, Cedar Mountain, Cherry Grove Blind Valley, Clinton Prairie, Compass Prairie, Cottonwood River Prairie, Des Moines River, Felton Prairie, Frenchman's Bluff, Glynn Prairie, Grey Cloud Dunes, Hastings Sand Coulee, Helen Allison Savanna, Hythecker Prairie, Iron Horse Prairie, Joseph A. Tauer Prairie, Kasota Prairie, King's and Queen's Bluffs, Langhei Prairie, Lundblad Prairie, Malmberg Prairie, Mound Spring Prairie, Osmundson Prairie, Otter Tail Prairie, Pembina Trail, Pin Oak Prairie, Prairie Coteau, Racine Prairie, Rice Lake Savanna, Richard M. and Mathilde Rice Elliot, Rock Ridge Prairie, Roscoe Prairie, Sandpiper Prairie, Savage Fen, Sedan Brook Prairie, Seminary Fen, Shooting Star Prairie, St. Croix Savanna, Twin Valley Prairie, Western Prairie, Wild Indigo, Yellow Bank Hills, Yellow Bank Hills"
"Rosa","blanda","smooth wild rose",0,0,0,0,0,0,1,0,0,0,0,0,0,0,0,0,0,0,"deciduous shrub & small tree","2","woods, prairies, outcroppings, throughout MN","2-6 ft","4-6 ft","rich","full sun to light shade",2,6,4,6,1,1,1,1,1,1,1,1,1,0,1,0,0,0,0,0,0,0,1,1,1,1,1,1,,,,,,,,,,,,,,"Black Lake Bog, Hastings Sand Coulee, Lake Alexander Woods, Myhr Creek Ridge, Pembina Trail, Uncas Dunes, Verlyn Marth Memorial Prairie, Wild Indigo"
"Rubus","parviflorus","thimbleberry",0,0,1,0,0,0,0,0,0,0,0,0,0,0,0,0,0,0,"deciduous shrub & small tree","2","wooded hillsides, stream banks, NE MN","2-8 ft",,"moist","shade",2,8,,,0,0,1,0,0,0,0,0,0,0,1,0,0,0,0,1,0,0,0,0,0,0,0,0,0,0,0,1,0,0,,,,,,,,"Hemlock Ravine, Hovland Woods, Iona's Beach, Lutsen, Moose Mountain, Purvis Lake-Ober Foundation, Spring Beauty Northern Hardwoods"
"Rudbeckia","hirta","black-eyed Susan",1,0,0,1,1,0,1,1,0,0,0,0,0,0,0,1,0,0,"flower & groundcover","2","prairies, open woodlands, throughout MN","1-3 ft",,"moist, average, well-drained","full sun to light shade",1,3,,,1,1,1,1,1,1,1,1,1,0,1,0,0,0,0,0,0,0,1,1,1,1,1,1,0,0,0,1,0,0,,,,,,,,"Blaine Preserve, Blanket Flower Prairie, Bluestem Prairie, Des Moines River, Felton Prairie, Gully Fen, Harry W. Cater Homestead Prairie, Helen Allison Savanna, Hythecker Prairie, Iron Horse Prairie, Kasota Prairie, Lake Bronson Parkland, Langhei Prairie, Lost Valley Prairie, Lundblad Prairie, Malmberg Prairie, Mound Prairie, Otter Tail Prairie, Pembina Trail, Pin Oak Prairie, Richard M. and Mathilde Rice Elliot, Roscoe Prairie, Santee Prairie, Savage Fen, Sedan Brook Prairie, Spring Creek Prairie, Twin Valley Prairie, Uncas Dunes, Western Prairie, Wild Indigo, Wood-Rill"
"Rudbeckia","laciniata","tall coneflower",0,0,0,1,1,0,1,1,0,0,0,0,0,0,0,0,0,0,"flower & groundcover","3","open areas, throughout MN","3-6 ft",,"moist","full sun to light shade",3,6,,,1,1,1,1,1,1,1,1,1,0,0,1,0,0,0,0,0,0,1,1,1,1,1,1,0,0,0,1,0,0,,,,,,,,"Avon Hills Forest, Bluestem Prairie, Cannon River Trout Lily, Cannon River Turtle Preserve, Chamberlain Woods, Clinton Falls Dwarf Trout Lily, Gully Fen, Kettle River, King's and Queen's Bluffs, Mississippi River Islands, Mound Spring Prairie, North Fork Zumbro Woods, Pine Bend Bluffs, Prairie Creek Woods, River Warren Outcrops, Savage Fen, Swedes Forest, Wild Indigo, Wolsfeld Woods, Wood-Rill, Wykoff Balsam Fir, Zumbro Falls Woods"
"Rudbeckia","triloba","three-leaved coneflower",0,0,0,1,1,0,1,1,0,0,0,0,0,1,0,0,0,0,"flower & groundcover","3","prairies, open woodlands","2-5 ft",,,,2,5,,,,,,,,,,,,0,0,1,0,,,,,,,,,,,,,,,,,,,,,,,,,
"Ruellia","humilis","wild petunia",0,0,0,0,1,0,0,0,0,1,0,0,0,0,0,0,0,0,"flower & groundcover","4","prairies, east-central MN","1-2 ft",,"well-drained","full sun",1,2,,,0,0,0,0,0,1,0,0,0,0,0,0,1,0,0,0,0,0,0,0,0,0,0,1,,,,,,,,,,,,,,
"Sagittaria","latifolia","broad-leaved arrowhead",0,0,0,0,0,0,0,0,0,0,0,0,1,0,0,0,0,0,"flower & groundcover","3","stream margins, ponds, throughout MN","12-36 in",,"fertile, heavy, loamy, submerged","full sun to light shade",1,3,,,1,1,1,1,1,1,1,1,1,0,0,1,0,0,0,0,0,0,1,1,1,1,1,1,0,0,0,0,0,1,,,,,,,,"Antelope Valley, Avon Hills Forest, Black Lake Bog, Boot Lake, Cedar Mountain, Hastings Sand Coulee, Itasca Wilderness Sanctuary, Kettle River, Mary Schmidt Crawford Woods, McGregor Marsh, Purvis Lake-Ober Foundation, Seminary Fen, St. Wendel Tamarack Bog, Swedes Forest, Twin Lakes, Uncas Dunes, Whitney Island, Wolsfeld Woods, Wood-Rill"
"Sanguinaira","canadensis","bloodroot",0,1,0,1,0,1,0,0,0,0,0,0,0,0,0,0,1,0,"flower & groundcover","3","woods, floodplains, throughout MN","4-10 in",,"moist, humus-rich","shade to spring sun",0.333333333333333,0.833333333333333,,,1,1,1,1,1,1,1,1,1,0,0,1,0,0,0,1,1,1,1,1,1,0,0,0,0,0,0,1,0,0,,,,,,,,
"Salix","amygdaloides","peach-leaved willow",0,0,0,0,0,0,0,1,0,0,0,0,0,1,0,0,0,0,"deciduous tree","3","throughout MN","40-60 ft",,,,40,60,,,1,1,1,1,1,1,1,1,1,0,0,1,0,,,,,,,,,,,,,,,,,,,,,,,,,"Itasca Wilderness Sanctuary, Savage Fen, Sugarloaf Point, Whitney Island"
"Salix","discolor","pussy willow",0,0,0,0,0,0,0,1,0,0,0,0,0,1,0,0,0,0,"deciduous shrub & small tree","3, trial in 2","shores, swamps, wetlands, all but SW MN","10-20 ft","10-15 ft","moist to wet","full sun",10,20,10,15,1,1,1,1,1,1,0,1,1,0,1,1,0,0,0,0,0,0,0,0,0,0,0,1,0,0,0,1,1,0,,,,,,,,"Black Lake Bog, Bluestem Prairie, Cedar Mountain, Felton Prairie, Gully Fen, Hythecker Prairie, Iron Horse Prairie, Iron Springs Bog, Kasota Prairie, Lake Bronson Parkland, Lost River Peatland, Luxemberg Peatland, Pembina Trail, Pine Creek Peatland, Red Lake Peatland, Roscoe Prairie, Savage Fen, Sedan Brook Prairie, Seminary Fen, Sprague Creek Peatland, St. Wendel Tamarack Bog, Two Rivers Aspen Parkland, Wabu Woods, Wild Indigo"
"Salix","humilis","prairie willow",0,0,0,0,0,0,0,1,0,0,0,0,0,1,0,0,0,0,"deciduous shrub & small tree","2","shores, swamps, wetlands, all but SW MN",,,,,,,,,1,1,1,1,1,1,0,1,1,0,1,0,0,,,,,,,,,,,,,,,,,,,,,,,,,"Badoura Jack Pine Woodland, Felton Prairie, Harry W. Cater Homestead Prairie, Helen Allison Savanna, Itasca Wilderness Sanctuary, Lake Bronson Parkland, Little Too Much Lake, Moose Mountain, Myhr Creek Ridge, Oronoco Prairie, St. Croix Savanna, Sugarloaf Point, Uncas Dunes"
"Salix","nigra","black willow",0,0,0,0,0,0,0,1,0,0,0,0,0,1,0,0,0,0,"deciduous tree","3","stream banks, wetlands, E MN","40-60 ft",,,,40,60,,,0,0,1,0,0,1,0,0,1,0,0,1,0,,,,,,,,,,,,,,,,,,,,,,,,,"Kellogg Weaver Dunes, Savage Fen, Seminary Fen, Whitney Island, Wood-Rill"
"Sambucus","canadensis","common elder",0,0,0,0,0,0,1,0,0,0,0,0,0,1,0,0,0,0,"deciduous shrub & small tree","2","S MN","8-10 ft","8-10 ft","moist, acidic to alkaline",,8,10,8,10,0,0,0,0,0,0,1,1,1,0,1,0,0,,,,,,,,,,,,0,0,0,1,0,0,1,1,1,1,1,1,1,"Cherry Grove Blind Valley, Compass Prairie, King's and Queen's Bluffs, Mississippi River Islands, Mound Spring Prairie, Seminary Fen, Swedes Forest, Uncas Dunes, Wolsfeld Woods, Wood-Rill, Wykoff Balsam Fir"
"Sambucus","pubens","scarlet elder",0,0,0,0,0,0,1,0,0,0,0,0,0,0,0,0,0,0,"deciduous shrub & small tree","2","woodlands, woodland edges, throughout MN","10 ft",,,"shade",10,10,,,1,1,1,1,1,1,1,1,1,0,1,0,0,0,0,1,0,0,0,0,0,0,0,0,,,,,,,,,,,,,,"Wild Indigo"
"Schizachyrium","scoparium","little bluestem",1,0,0,1,1,0,0,1,0,0,0,0,0,0,0,1,0,0,"grass & sedge","3","prairies, savannas, all but far NE MN","2-3 ft",,"well-drained, sand, loam","full sun to partial shade",2,3,,,1,1,0,1,1,1,1,1,1,0,0,1,0,0,0,0,0,1,1,1,1,1,1,1,,,,,,,,,,,,,,"Antelope Valley, Blanket Flower Prairie, Bluestem Prairie, Bonanza Prairie, Cannon River Turtle Preserve, Cedar Mountain, Cedar Rock, Chimney Rock, Clinton Prairie, Compass Prairie, Cottonwood River Prairie, Des Moines River, Felton Prairie, Frenchman's Bluff, Glynn Prairie, Gneiss Outcrops, Grey Cloud Dunes, Harry W. Cater Homestead Prairie, Hastings Sand Coulee, Helen Allison Savanna, Hythecker Prairie, Iron Horse Prairie, Kasota Prairie, Kellogg Weaver Dunes, King's and Queen's Bluffs, Lake Bronson Parkland, Lost Valley Prairie, Malmberg Prairie, Mound Prairie, Mound Spring Prairie, Oronoco Prairie, Osmundson Prairie, Otter Tail Prairie, Pembina Trail, Pin Oak Prairie, Pine Bend Bluffs, Prairie Coteau, Racine Prairie, Rice Lake Savanna, Richard M. and Mathilde Rice Elliot, Ripley Esker, River Terrace Prairie, Rock Ridge Prairie, Roscoe Prairie, Santee Prairie, Sedan Brook Prairie, Spring Creek Prairie, St. Croix Savanna, Swedes Forest, Uncas Dunes, Verlyn Marth Memorial Prairie, Western Prairie, Wild Indigo, Yellow Bank Hills"
"Senecio","aureus","golden ragwort",0,0,0,0,1,0,0,0,0,0,0,0,0,1,0,0,0,0,"flower & groundcover","3","woods, swamps, throughout MN","1-2 ft",,"moist, slightly acidic","full sun to partial shade",1,2,,,1,1,1,1,1,1,1,1,1,0,0,1,0,0,0,0,0,1,1,1,1,1,1,1,0,0,0,1,0,0,0,0,1,0,0,0,0,"Lester Lake, Two Rivers Aspen Parkland"
